鳩山町,https://www.town.hatoyama.saitama.jp/event/1585134221551.html,セーフティネット保証制度／鳩山町ホームページ ,「経営あんしん資金（新型コロナウイルス特例）」 新型コロナウイルス感染症の影響を受けた中小企業者への支援措置 経営あんしん資金（新型コロナ特例）について（PDF：340.5KB） 経済産業省は、新型コロナウイルス感染症の影響により業績が悪化している中小企業者・小規模事業者の支援措置として、47都道府県を、セーフティネット保証4号の地域に指定しました。
歌志内市,https://www.city.utashinai.hokkaido.jp/hotnews/detail/00002006.html,新型コロナウイルス感染症の影響による市営住宅入居者に対する家賃減免措置について | 北海道歌志内市 ,新型コロナウイルス感染症の影響による市営住宅入居者に対する家賃減免措置について
豊山町,https://www.town.toyoyama.lg.jp/chosei/yakuba-annai/1001336/1002796.html,新型コロナウイルス感染症の影響による水道料金・下水道使用料の支払い猶予について【更新日:4月3日】｜豊山町公式ウェブサイト ,新型コロナウイルス感染症の影響による水道料金・下水道使用料の支払い猶予について【更新日
文化庁,https://www.bunka.go.jp/koho_hodo_oshirase/sonota_oshirase/2020020601.html,新型コロナウイルスの影響を受ける文化芸術関係者に対する支援情報窓口 | 文化庁 ,新型コロナウイルスの影響を受ける文化芸術関係者に対する支援情報窓口 新型コロナウイルスの影響を受ける文化芸術関係者に対する支援情報窓口|文化庁
弘前市,https://www.city.hirosaki.aomori.jp/index.html,弘前市 ,新型コロナウイルス感染症に対応した弘前市立小・中学校の臨時休業について 新型コロナウイルス感染症の影響を受ける事業者への支援策
新見市,https://www.city.niimi.okayama.jp/important/important_detail/index/320.html,新型コロナウイルス感染症拡大の影響により上下水道料金および市営住宅家賃の納付が困難な方へ納付の猶予制度があります | 重要なお知らせ | 新見市 | 岡山県新見市 公式ホームページ ,新型コロナウイルス感染症の影響により、事業の継続が困難となった場合や収入が大幅に減少した場合で、上下水道料金および市営住宅家賃の納付が困難な方は、一定期間納付を猶予します。 新型コロナウイルス感染症拡大の影響により上下水道料金および市営住宅家賃の納付が困難な方へ納付の猶予制度があります 新型コロナウイルス感染症拡大の影響により上下水道料金および市営住宅家賃の納付が困難な方へ納付の猶予制度があります|重要なお知らせ|新見市|岡山県新見市公式ホームページ
農林水産省,https://www.maff.go.jp/j/keiei/nougyou_jinzaiikusei_kakuho/singatakoronataiou/syougakkoukyuukou.html,小学校休業等対応助成金：農林水産省 ,新型コロナウイルス感染症により小学校等が休校になった保護者（労働者）に対し、有給の休暇を取得させた事業主に助成金が支給されます。
千曲市,https://www.city.chikuma.lg.jp/docs/2020040300043/index.html,新型コロナウイルス感染拡大の影響による休業や失業で、生活資金にお悩みの皆様へ | 千曲市 ,新型コロナウイルス感染拡大の影響による休業や失業で、生活資金にお悩みの皆様へ2020年4月3日 新型コロナウイルス感染拡大の影響による休業や失業で、生活資金にお悩みの皆様へ|千曲市 長野県社会福祉協議会では、低所得世帯等に対して、生活福祉資金貸付事業を実施しています。今回、新型コロナウイルス感染症の影響を踏まえ、緊急小口資金について特例による貸付を実施します。
神奈川県,https://www.pref.kanagawa.jp/docs/m6c/cnt/f5782/corona.html,新型コロナウイルス関連融資 - 神奈川県ホームページ ,新型コロナウイルスの流行により事業活動に影響を受けている中小企業の皆さまに金融支援を実施します 新型コロナウイルスの流行により事業活動に影響を受けている中小企業の皆さまに金融支援を実施します-神奈川県ホームページ 新型コロナウイルス対策特別融資（4号別枠）
奈良市,http://www.city.nara.lg.jp/site/kyouiku/67999.html,市立学校における新型コロナウイルスへの対応について - 奈良市ホームページ ,市立学校における新型コロナウイルスへの対応について
吉賀町,https://www.town.yoshika.lg.jp/bousai/koronavirus/koronazigyousyataiyou.html,吉賀町:（事業者向け）新型コロナウイルス感染症に関する緊急対応策について ,吉賀町新型コロナウイルス感染症対策小規模事業者経営改善資金利子補給金 従来の「吉賀町小規模事業者経営改善資金利子補給金」とは別枠で新型コロナウイルス感染症で影響を受けた事業者に関しては、「吉賀町新型コロナウイルス感染症対策小規模事業者改善資金利子補給金」を受けることができます。 新型コロナウイルス感染症の影響を受け、従業員を休業させた場合、休業手当の一部を国が負担する「雇用調整助成金」の支給決定を受けた事業者を対象に町の上乗せ助成として「吉賀町緊急雇用調整助成金」を交付します。 （事業者向け）新型コロナウイルス感染症に関する緊急対応策について
南相馬市,https://www.city.minamisoma.lg.jp/portal/health/kenko/2/1/1/11428.html,セーフティネット保証制度（中小企業信用保険法第2条第5項の認定）／南相馬市公式ウェブサイト -Minamisoma City- ,運転資金、設備資金などのための融資制度の新型コロナウイルス対策資金、外的変化対応資金など
奈良市,http://www.city.nara.lg.jp/site/kosodate/10822.html,幼稚園・保育所・認定こども園・地域型保育事業の手続きについて　 - 奈良市ホームページ ,今般の新型コロナウイルス感染症拡大に伴い、別紙のとおり特例措置を設けております。 新型コロナウイルス感染症対策に伴う、4月入園及び在園中の方に対する特例措置について 新型コロナウイルス感染症対策に伴う特例措置について（令和2年4月13日現在）[PDFファイル／137KB]
山鹿市,https://www.city.yamaga.kumamoto.jp/www/contents/1582766263677/index.html,新型コロナウィルスに関する中小企業・小規模事業者支援について | 山鹿市 ,また、新型コロナウイルスの流行により、売上減少等が生じている中小企業向けの融資制度が創設されています。 商工業&nbsp;&gt;新型コロナウィルスに関する中小企業・小規模事業者支援について 新型コロナウィルスに関する中小企業・小規模事業者支援について 新型コロナウィルスに関する中小企業・小規模事業者支援について|山鹿市 新型コロナウイルスの流行により影響を受ける、またはその恐れがある中小企業・小規模事業者を対象として、九州経済産業局のほか相談窓口が設置されています。 新型コロナウイルス感染症の影響に伴う雇用調整助成金の特例（厚生労働省） 熊本県（新型コロナウィルス感染症対策の資金繰り支援） 緊急情報&nbsp;&gt;新型コロナウィルスに関する中小企業・小規模事業者支援について
宇陀市,https://www.city.uda.nara.jp/s-kikaku/koyouchouseijoseikin.html,宇陀市／【事業者の方へ】雇用調整助成金について ,【事業者の方へ】小規模事業者持続化補助金における新型コロナウイルス感染症による影響を受けた事業者の証明書の発行について 【事業者の方へ】新型コロナウイルス感染症により影響を受けている中小企業・小規模事業者への金融支援について 新型コロナウイルス感染症の影響などその他の経済上の理由により、事業活動の縮小を余儀なくされた事業主が、一時的な雇用調整を実施することによって従業員の雇用を維持した場合、雇用調整助成金が助成されます。
沖縄県,https://www.pref.okinawa.jp/site/kodomo/fukushi/chiiki/seikon/syurokunren.html,生活困窮者就労訓練事業について／沖縄県 ,新型コロナウイルス感染症で影響を受けた事業者に対する支援等について
日野市,https://www.city.hino.lg.jp/faq/fukushi/fukushi/1014096.html,日野市社会福祉協議会で新型コロナウイルスにより収入が減少した世帯に対する特例貸付を実施しています｜日野市公式ホームページ ,新型コロナウイルス感染症の影響を受け、休業等により収入の減少があり、緊急かつ一時的な生計維持のための貸付を必要とする世帯。 新型コロナウイルス感染症の発生による休業や失業等により、一時的又は継続的に収入が減少した世帯を対象として、生活福祉資金貸付制度における福祉資金（緊急小口資金）及び総合支援資金（生活支援費）について特例措置が設けられました。 日野市社会福祉協議会で新型コロナウイルスにより収入が減少した世帯に対する特例貸付を実施しています 日野市社会福祉協議会で新型コロナウイルスにより収入が減少した世帯に対する特例貸付を実施しています｜日野市公式ホームページ
福岡県,https://www.pref.fukuoka.lg.jp/press-release/corona-02003122.html,新型コロナウイルス感染症に係る「危機関連保証」の対象事業者に対する県制度融資の保証料をゼロにし、中小企業への資金繰り支援をさらに強化します！ - 福岡県庁ホームページ ,新型コロナウイルス感染症に係る「危機関連保証」の対象事業者に対する県制度融資の保証料をゼロにし、中小企業への資金繰り支援をさらに強化します！ 新型コロナウイルス感染症に係る「危機関連保証」の対象事業者に対する県制度融資の保証料をゼロにし、中小企業への資金繰り支援をさらに強化します！-福岡県庁ホームページ
群馬県,https://www.pref.gunma.jp/02/d10g_00135.html,群馬県 - 病院内保育所等が臨時・追加的に実施する学童保育に対する緊急的な財政支援対策について【3月17日締切】 ,新型コロナウイルス感染症対策に伴う小学校及び特別支援学校の臨時休校により、３月２日から春休みの前日までの期間の平日において病院内保育所等を活用し、（１）午前中から学童保育の受入れを行う。（２）新たに終日学童保育の受入れを行う。
神奈川県,https://www.pref.kanagawa.jp/docs/k5n/soudan/yakan.html,夜間労働相談 - 神奈川県ホームページ ,※新型コロナウイルス感染症の拡大防止のため、当面の間、原則として電話での相談とし、来所での相談は実施しません。詳しくは各窓口の問合せ先までお問い合わせください。 新型コロナウイルス感染症の影響による労働相談も受け付けています。
矢吹町,http://www.town.yabuki.fukushima.jp/page/page004198.html,新型コロナウイルスの影響により納税が困難な方へ 徴収猶予の「特例制度」（案）のご案内&nbsp;|&nbsp;矢吹町公式ホームページ ,・新型コロナウイルスの影響により事業等に係る収入に相当の減少があった方は、１年間、町税の徴収の猶予を受けることができるようになります。・無担保で延滞金もかかりません。 新型コロナウイルスの影響により納税が困難な方へ徴収猶予の「特例制度」（案）のご案内 新型コロナウイルスの影響により納税が困難な方へ徴収猶予の「特例制度」（案）のご案内&nbsp;|&nbsp;矢吹町公式ホームページ 納税相談について（新型コロナウイルス感染症の影響により納税が困難な納税者の方へ）
美浜町,http://www.town.aichi-mihama.lg.jp/docs/2020033100018/index.html,新型コロナウイルス感染症の発生に係る緊急経済対策信用保証料補助金について | 愛知県美浜町 ,新型コロナウイルス感染症の発生に伴い、セーフティネット保証を利用される中小企業・小規模事業者の方に対して美浜町緊急経済対策信用保証料補助金を新設しました。
宮城県,http://www.pref.miyagi.jp/soshiki/syahuku/seikatusikin-corona.html,新型コロナウイルス感染症の影響を踏まえた生活福祉資金貸付制度における緊急小口資金等の特例貸付の実施について - 宮城県公式ウェブサイト ,新型コロナウイルス感染症の影響を踏まえた生活福祉資金貸付制度における緊急小口資金等の特例貸付の実施について 新型コロナウイルス感染症の影響を踏まえた生活福祉資金貸付制度における緊急小口資金等の特例貸付の実施について-宮城県公式ウェブサイト
厚生労働省 厚生労働省,https://www.mhlw.go.jp/stf/seisakunitsuite/bunya/koyou_roudou/koyou/kyufukin/pageL07.html,雇用調整助成金 ｜厚生労働省 ,新型コロナウィルス感染症により影響を受ける事業主を支援するため、以下のような取組を行っています。
雲南市,https://www.city.unnan.shimane.jp/unnan/sangyou/jigyousyamuke/index.html,事業者向け情報 | 雲南市ホームページ ,新型コロナウイルス感染症に関する事業者支援策等について2020年3月18日
神奈川県,https://www.pref.kanagawa.jp/chiji/press-conference/2019/0319.html,定例記者会見（2020年3月19日）結果概要 - 神奈川県ホームページ ,今回の補正予算案では、新型コロナウイルス感染症の拡大防止等を図るため、国の緊急対応策を踏まえた対策に加えて、当面、県独自に対応する必要がある対策について、概ね７月までの事業費を措置することにいたしました。 県としても、できる限りのことをやっていきたいと考えておりまして、取りあえずは新型コロナ関連の融資を拡充。それからホテル、旅館などの資金繰りについて、具体にしっかりと、支援していくといったことで、何とかして箱根も守ろうと、守り通そうと強く思っています。
浜松市,https://www.city.hamamatsu.shizuoka.jp/nousei/koronataioumtg.html,【事業者募集】新型コロナウイルス感染症対策・一次産業者等マッチング事業について／浜松市 ,【事業者募集】新型コロナウイルス感染症対策・一次産業者等マッチング事業について 新型コロナウイルス感染症の影響により納付が困難な方に対する令和2年度に課税される市税等における納税の猶予
文化庁,https://www.bunka.go.jp/koho_hodo_oshirase/sonota_oshirase/20200206.html,新型コロナウイルスに関連した感染症対策に関する対応について | 文化庁 ,文化財に係る国庫補助事業における，新型コロナウイルス感染症の感染拡大防止対策について，緊急事態宣言を踏まえ，今後の対応について改めてお知らせするものです。 新型コロナウイルスの影響を受ける文化芸術関係者に対する支援情報窓口 新型コロナウイルス感染症に関する都道府県・保健所等による電話相談窓口
弥富市,https://www.city.yatomi.lg.jp/kurashi/1000156/1003640/index.html,新型コロナウイルス感染症の影響により市税・保険料の納付が困難な方へ｜弥富市公式ホームページ ,新型コロナウイルス感染症に納税者がり患された場合のほか、新型コロナウイルス感染症に関連するなどして以下のようなケースに該当する場合は、猶予制度がありますので、各担当課にご相談ください。 新型コロナウイルス感染症の影響により、市税を一時に納付することができない場合に、申請による換価（売却）の猶予制度がありますので、収納課までご相談ください。
岩手県,https://www.pref.iwate.jp/sangyoukoyou/nourinsuisan/kinyuu/index.html,岩手県 - 金融共済 ,新型コロナウイルス感染症に係る農林水産業相談窓口 新型コロナウイルス感染症に係る農林漁業資金の相談窓口等について
青森県,http://www.pref.aomori.lg.jp/life/tax/nouzei_yuuyo.html,新型コロナウイルス感染症の影響により納税が困難な方に対する猶予制度 - 青森県庁ホームページ ,・新型コロナウイルス感染症の影響により納税が困難な方に対する猶予制度＜PDF＞ 新型コロナウィルス感染症の影響により、県税を一時に納付することができない方について、一定の要件を満たす場合に納税が猶予される制度があります。 新型コロナウイルス感染症の影響により納税が困難な方に対する猶予制度-青森県庁ホームページ 更新日付：2020年3月24日税務課新型コロナウイルス感染症の影響により納税が困難な方に対する猶予制度
秩父市,https://www.city.chichibu.lg.jp/8021.html,新型コロナウイルス感染症対策の事業者支援/秩父市 ,setCookie('anchortitle' '新型コロナウイルス感染症対策の事業者支援' null); 新型コロナウイルス感染症対策に関連した、事業者への支援メニューを紹介します。 新型コロナウイルス感染症対策の事業者支援 新型コロナウイルス感染症対策の事業者支援/秩父市
神奈川県,https://www.pref.kanagawa.jp/docs/m6c/prs/r5118881.html,新型コロナウイルス関連融資の信用保証料を最大ゼロに引き下げます - 神奈川県ホームページ ,＜参考資料＞既存の新型コロナウイルス関連融資一覧、制度融資取扱金融機関の一覧（PDF：426KB）
,答ありがとうございます, ,
萩市,https://www.city.hagi.lg.jp/soshiki/49/h31121.html,新型コロナウイルス感染症に伴う中小企業者等経営安定化緊急対策について（融資・利子補給制度） - 萩市ホームページ ,新型コロナウイルス感染症に伴う中小企業者等経営安定化緊急対策について（融資・利子補給制度） 新型コロナウイルス感染症に伴う中小企業者等経営安定化緊急対策について（融資・利子補給制度）-萩市ホームページ
東伊豆町,https://www.town.higashiizu.shizuoka.jp/bg/life/ent/2806.html,東伊豆町｜くらし｜水道料金の支払い期限の延長（猶予）について ,東伊豆町では「新型コロナウイルス感染症」の影響により水道料金のお支払いが困難となった方に対し、お支払い期限の延長（猶予）のご相談に応じます。
島根県,https://www.pref.shimane.lg.jp/medical/fukushi/chiiki/hukusi_sikin/seikatuhukusisikinn.html,島根県：生活福祉資金特例貸付～新型コロナの影響で生活資金にお悩みの方へ～（トップ / 医療・福祉 / 福祉 / 地域福祉 / 生活福祉資金） ,島根県内に居住し、新型コロナウイルスの影響を受け、休業等により収入の減少があり、緊急かつ一時的な生計維持のための貸付を必要とする世帯。※従来の低所得世帯等に限定した取扱を拡大 島根県：生活福祉資金特例貸付～新型コロナの影響で生活資金にお悩みの方へ～（トップ/医療・福祉/福祉/地域福祉/生活福祉資金） 新型コロナウイルス感染症の影響による休業や失業で生活資金にお悩みの方へ 新型コロナウイルス感染症の影響を踏まえ、貸付の対象世帯を低所得世帯以外に拡大し、休業や失業等により生活資金でお悩みの方々に向けた、緊急小口資金等の特例貸付が実施されています。 生活福祉資金特例貸付～新型コロナの影響で生活資金にお悩みの方へ～
島根県,https://www.pref.shimane.lg.jp/industry/syoko/sangyo/yuushi/koronamadoguchi.html,島根県：新型コロナウイルスに関する中小企業、小規模事業者向け情報等（トップ / しごと・産業 / 商工業 / 産業振興 / 融資） ,島根県：新型コロナウイルスに関する中小企業、小規模事業者向け情報等（トップ/しごと・産業/商工業/産業振興/融資） 新型コロナウイルスに関する中小企業、小規模事業者向け情報等
芦屋市,https://www.city.ashiya.lg.jp/keizai/sefu_net.html, ,新型コロナウイルス感染症の影響により売上高等が減少している中小企業者・小規模事業者の資金繰り支援措置として、全国47都道府県を対象にセーフティネット保証4号が発動されました。
豊中市,https://www.city.toyonaka.osaka.jp/joho/kouhou/news/R2news_shisei/2020_01.html,新型コロナウイルス対策信用保証料助成金を創設　豊中市 ,令和2年（2020）4月13日※新型コロナウイルス感染症の影響により、すでに上記4号、5号及び6項の認定を受けた事業者にも遡って助成します。 新型コロナウイルス対策信用保証料助成金を創設
菊川市,https://www.city.kikugawa.shizuoka.jp/kosodate/kyouiku/news.html,菊川市／教育委員会ニュース ,これは、新型コロナウイルスの感染拡大を防止するための臨時の措置です。この趣旨をよく理解いただき、児童生徒は人の集まる場所等への外出を避け、基本的に自宅で過ごすようご協力をお願いします。 新型コロナウイルス感染症の拡大防止を目的として、次のとおり小中学校の臨時休業を行います。 新型コロナウイルス感染症対策で、県内の学校が一斉に臨時休業となっているところ、「子供だけで留守番をしている家に不審者が出没する」という事案が発生しました。 現在は、コロナウイルスの関係で学校は休業中です。子供たちは外出を控え、自宅で学習をしておりますが、子供だけで留守番をしていることの不安もあります。
八幡浜市,http://www.city.yawatahama.ehime.jp/docs/2020031000044/index.html,【令和２年新型コロナウイルス感染症】事業者向け支援政策について | 八幡浜市公式HP ,●新型コロナウイルス対策補助事業(マスク生産のための設備を導入する事業者への支援など) 【令和２年新型コロナウイルス感染症】事業者向け支援政策について2020年3月27日 【令和２年新型コロナウイルス感染症】事業者向け支援政策について|八幡浜市公式HP 新型コロナウイルス感染症の影響により、一定の売上減少が生じている中小企業・小規模企業者の方に対し、低金利の融資や、災害時の特例的な保証が受けられるようになっています。
菊川市,https://www.city.kikugawa.shizuoka.jp/2020sinngatakorona/matomepezi.html,菊川市／新型コロナウイルス感染症関連情報 ,新型コロナウイルス感染症により、生活や事業活動に影響を受けている市民や事業者の皆様が利用できる相談窓口や支援策の問い合わせ先をまとめたリーフレットを作成しました。
臼杵市,https://www.city.usuki.oita.jp/article/2020032500062/index.html,中小企業向け利子補給制度について（新型コロナウイルス感染症関連） | 臼杵市役所 ,新型コロナウイルス感染症の影響を受けた中小企業の資金繰りの円滑化を図るため、県の「新型コロナウイルス感染症緊急対策特別資金」による融資を受けた市内中小企業に対し、臼杵市が利子補給を行います。 新型コロナウイルス感染症緊急対策特別資金融資に係る通知書及び償還予定表の写し 臼杵市新型コロナウイルス感染症緊急対策特別資金特別融資利子補給認定申請書（様式第１号）[DOCX：17.2KB] 臼杵市新型コロナウイルス感染症緊急対策特別資金特別融資利子補給金 臼杵市新型コロナウイルス感染症緊急対策特別資金特別融資利子補給金交付申請書（様式第３号）[DOCX：18KB] 臼杵市新型コロナウイルス感染症緊急対策特別資金特別融資利子補給金交付請求書（様式第５号）[DOCX：16.5KB] 運転資金として1 000万円以下の「新型コロナウイルス感染症緊急対策特別資金」による融資を受けた者
