埼玉県,https://www.pref.saitama.lg.jp/a0805/shikinguri.html,県の資金繰り措置について - 埼玉県 ,新型コロナウイルスの影響を受けた中小企業者に対して、国がセーフティネット保証4号及び5号による金融支援を拡充させたことに伴い、中小企業制度融資の「経営安定資金（災害復旧関連）」と「経営安定資金（特定業種関連）」がご利用できます。&nbsp;
経済産業省 経済産業省,https://www.meti.go.jp/press/2019/03/20200311004/20200311004.html,遠隔健康相談事業を開始します！ （METI/経済産業省） ,経済産業省は、新型コロナウイルス感染症の感染拡大の懸念等を含め、国民が抱える健康不安を遠隔で医師に無料で相談できる健康相談窓口を設置します。
あま市,https://www.city.ama.aichi.jp/bussiness/sangyo/syoukou/1006367.html,事業者向け緊急経済対策関連情報について（持続化給付金等）｜あま市公式ウェブサイト ,小規模事業者持続化補助金におけるついて新型コロナウイルス感染症の影響を受けた事業者の証明について
長崎市,https://www.city.nagasaki.lg.jp/jigyo/360000/362000/p034103.html,長崎市│新型コロナウイルス感染症により影響を受けている事業者の方へ ,今般の新型コロナウイルス感染症の影響を受ける、またはその恐れがある中小企業者等を支援するため、相談窓口を設置しています。 新型コロナウイルスに関する相談窓口（新しいウィンドウで開きます） 新型コロナウイルスの感染拡大により影響を受ける県内中小企業者の資金繰りに対応するため、長崎県中小企業向け融資制度の「緊急資金繰り支援資金（環境変化対策）」の取扱を開始しています。 新型コロナウイルス感染症により影響を受けている事業者の方へ 新型コロナウイルス感染症により影響を受ける中小企業者の資金繰りに対応するため、災害復旧等支援資金の取扱を開始しました。 新型コロナウイルス感染症により影響を受ける事業者の方へ、資金繰りに関する支援制度として、中小企業向け融資制度や相談窓口をご案内します。 新型コロナウイルス感染症の影響により、全国の中小企業・小規模事業者の資金繰りが逼迫していることを踏まえ、危機関連保証が初めて実施されます。
福島県,http://www.pref.fukushima.lg.jp/sec/21025a/index.html,社会福祉課 - 福島県ホームページ ,新型コロナウイルス感染症の影響による休業等に関する生活福祉資金（緊急小口資金等）特例貸付について
愛媛県,https://www.pref.ehime.jp/k70200/k70200.html,愛媛県庁／教育総務課 ,新型コロナウイルスの感染症対策に係る全国一律の学校の臨時休校措置要請への対応に関する記者発表の要旨について
知多市,https://www.city.chita.lg.jp/docs/2020041000034/index.html,市立小中学校の臨時休業に伴う対応（自主登校教室、放課後児童クラブ）について | 知多市 ,新型コロナウイルスに伴う市立小中学校の臨時休業について 新型コロナウイルスの感染拡大防止に伴う愛知県からの緊急事態宣言に従い、臨時休業期間を、４月８日（水）から５月６日（水・振替休日）までに延長します。
川場村,http://www.vill.kawaba.gunma.jp/info/index.html,川場村役場「2020年(令和2年)新型コロナウイルス感染症関連情報」 ,2020年4月2日新型コロナウイルス相談窓口一本化について
宮城県,http://www.pref.miyagi.jp/soshiki/tiroui/korona-sodan.html,新型コロナウィルス感染症に関する労働相談について - 宮城県公式ウェブサイト ,新型コロナウィルス感染症に関する労働相談について 新型コロナウィルス感染症に関する労働相談について-宮城県公式ウェブサイト
川崎市,http://www.city.kawasaki.jp/280/page/0000115859.html,川崎市：新型コロナウイルス感染症の影響でお困りの市内中小企業者等の皆様へ経営安定資金で支援します。 ,川崎市：新型コロナウイルス感染症の影響でお困りの市内中小企業者等の皆様へ経営安定資金で支援します。 新型コロナウイルスに関する市内中小企業支援として融資や経営に関する「経営相談窓口」を設置します 新型コロナウイルス感染症の影響でお困りの市内中小企業者等の皆様へ経営安定資金で支援します。
大洗町,https://www.town.oarai.lg.jp/~kankouka/kurasi/info-3679-72_3.html,大洗町 茨城県パワーアップ融資にかかる信用保証料補助制度の創設について ,大洗町では新型コロナウイルス感染症により影響を受けた中小事業者を支援するために、
下関市,http://www.city.shimonoseki.lg.jp/www/contents/1583381707607/index.html,新型コロナウイルス感染症の発生状況について | 下関市 ,保健部（保健所）保健医療政策課新型コロナウイルス相談窓口
岡垣町,https://www.town.okagaki.lg.jp/s014/020/011/150/20200129153518.html,新型コロナウイルス感染症に伴う税・公共料金などの支払期限の延長（猶予） - 岡垣町 ,新型コロナウイルス感染症に伴う税・公共料金などの支払期限の延長（猶予） 新型コロナウイルス感染症に伴う税・公共料金などの支払期限の延長（猶予）-岡垣町 新型コロナウイルス感染症の感染拡大に伴い、一部の税や公共料金などの支払期限を延長（猶予）します。
日立市,https://www.city.hitachi.lg.jp/shimin/002/006/covidsoudan.html,日立市｜新型コロナウイルス緊急総合相談窓口の開設について ,新型コロナウイルス緊急総合相談窓口 新型コロナウイルス緊急総合相談窓口の開設について 日立市｜新型コロナウイルス緊急総合相談窓口の開設について
青森県,http://www.pref.aomori.lg.jp/soshiki/kenko/kodomo/boshifushikahushikin.html,母子父子寡婦福祉資金の貸付について - 青森県庁ホームページ ,今般の新型コロナウイルス感染症の発生に伴い、保育所や学校等の臨時休業、事業所等の休業などにより、就労収入が一時的に減少する場合、母子父子寡婦福祉資金の「生活資金」を利用いただけますので、上記の貸付申請・相談窓口へご相談ください。 新型コロナウイルス感染症の発生に伴う母子父子寡婦福祉資金貸付金の償還金の支払い猶予等の取扱いについて
厚生労働省 厚生労働省,https://www.mhlw.go.jp/stf/newpage_10231.html,新型コロナウイルス感染症による小学校休業等対応支援金　 ,New新型コロナウイルス感染症による小学校休業等対応支援金(委託を受けて個人で仕事をする方向け)＜4月以降分＞ 新型コロナウイルスの感染拡大防止策として、小学校等が臨時休業した場合等に、その小学校等に通う子どもの世話を行うため、契約した仕事ができなくなっている子育て世代を支援するための新たな支援金を創設しました。 新型コロナウイルス感染症による小学校休業対応助成金・支援金の申請受付を開始します 新型コロナウイルス感染症による小学校休業等対応助成金・支援金の延長について 新型コロナウイルス感染症による小学校休業等対応助成金・支援金の支給要領の改正について 新型コロナウイルス感染症による小学校休業等対応支援金 新型コロナウイルス感染症による小学校休業等対応支援金(委託を受けて個人で仕事をする方向け) 新型コロナウイルス感染症による小学校休業等対応支援金（委託を受けて個人で仕事をする方向け）
留萌市,https://www.e-rumoi.jp/keizai/page17_00109.html,セーフティネット保証制度(4号：令和2年新型コロナウイルス感染症関係) - 留萌市ホームページ ,セーフティネット保証制度(4号：令和2年新型コロナウイルス感染症関係) 新型コロナウイルス感染症により影響を受けている中小企業者への資金繰り支援措置として、令和2年3月2日から北海道を含む47都道府県がセーフティネット4号における指定地域に指定されました。
長野県,https://www.pref.nagano.lg.jp/keieishien/corona.html,新型コロナウイルス感染症に伴う中小企業者向けポータルサイト／長野県 ,3月19日新型コロナウイルス感染症の影響を受ける中小企業等の資金繰りを支援するため、中小企業融資制度を拡充します 4月9日中小企業・小規模事業者対象の新型コロナウイルスの感染拡大に伴う経営・雇用に関する相談窓口を拡充します ○中小企業・小規模事業者を対象とした新型コロナウイルス流行に伴う経営・雇用に関する相談窓口の対応について
京都府,https://www.pref.kyoto.jp/gyomusuishin/novelcoronavirus-line.html,一人ひとりに合わせた新型コロナ対策をLINEでサポートします／京都府ホームページ ,（京都市内にお住まいの方向け）京都市新型コロナウイルス感染症専用相談窓口(japaneseonly)
十和田市,http://www.city.towada.lg.jp/docs/2020040800017/index.html,新型コロナウイルス感染症に関する緊急相談窓口開設中（市税・保険料・使用料・奨学金の支払い猶予等） | 十和田市 ,新型コロナウイルス感染症に関する緊急相談窓口開設中（市税・保険料・使用料・奨学金の支払い猶予等）2020年4月13日 新型コロナウイルス感染症に関する緊急相談窓口開設中（市税・保険料・使用料・奨学金の支払い猶予等）|十和田市
目黒区,https://www.city.meguro.tokyo.jp/kurashi/anzen/newcorona/soudan.html,新型コロナウイルスに関する相談窓口　目黒区 ,今般の新型コロナウイルスの流行により事業活動に影響を受ける、または、その恐れがある中小企業の方を支援するため、専門家による資金繰りや経営に関する相談や各種支援制度の申請を受け付けています。 新型コロナウイルスに関する相談窓口 新型コロナウイルスに関する相談窓口目黒区 新型コロナウイルスの対応などに関する相談窓口をご案内します。 新型コロナウイルス感染症に関連して住民税や保険料の納付が困難になった場合、徴収の猶予等が認められることがありますので、ご相談ください。 目黒区保健所新型コロナ受診相談窓口（帰国者・接触者電話相談センター） 目黒区社会福祉協議会で実施する緊急小口資金と併せて、新型コロナウイルス感染症の影響を受け、生活に困窮し、日常生活の維持が困難になっている世帯に、貸付を受けることができます。
和歌山県,https://www.pref.wakayama.lg.jp/prefg/010500/yuuyo-tokurei.html,新型コロナウイルスの影響により納税が困難な方へ徴収猶予の「特例制度」（案） | 和歌山県 ,&gt;新型コロナウイルスの影響により納税が困難な方へ徴収猶予の「特例制度」（案） 新型コロナウイルスの影響により、令和2年2月以降の任意の期間（1か月以上）において、事業等に係る収入が前年同期に比べて概ね20％以上減少していること。 新型コロナウイルスの影響により納税が困難な方へ徴収猶予の「特例制度」(案) 新型コロナウイルスの影響により納税が困難な方へ徴収猶予の「特例制度」（案） 新型コロナウイルスの影響により納税が困難な方へ徴収猶予の「特例制度」（案）|和歌山県
経済産業省 経済産業省,https://www.meti.go.jp/policy/safety_security/industrial_safety/oshirase/2020/04/20200410-02.html,新型コロナウイルスの影響を踏まえた措置について（液石法施行規則に規定する期間延長）（METI/経済産業省） ,新型コロナウイルスの影響を踏まえた措置について（液石法施行規則に規定する期間延長） 新型コロナウイルスの影響を踏まえた措置について（液石法施行規則に規定する期間延長）（METI/経済産業省）
沖縄県,https://www.pref.okinawa.jp/site/shoko/keiei/kinyu/singatakorona.html,新型コロナウイルス感染症で影響を受けた事業者に対する支援等について／沖縄県 ,なお、詳細については、下記の「新型コロナウイルス感染症で影響を受けた事業者に対する中小企業セーフティネット資金の適用について」の内容をご確認ください。 ホーム&gt;新型コロナウイルス感染症で影響を受けた事業者に対する支援等について 今回の新型コロナウイルスの流行により、事業経営に影響を受ける又はその恐れがある中小企業・小規模事業者等を対象として、県内の各中小企業支援機関に「経営相談窓口」が設置されています。 新型コロナウイルス感染症で影響を受けた事業者に対する支援等について 新型コロナウイルス感染症で影響を受けた事業者に対する支援等について／沖縄県 県では新型コロナウイルス感染症を中小企業セーフティネット資金の融資対象４の災害として認定し、新型コロナウイルス感染症で影響を受けられた事業者に対する金融支援を行います。
福井県,https://www.pref.fukui.lg.jp/doc/zeimu/nofu_konnan2.html,新型コロナウイルスの影響により納税が困難な方へ　徴収猶予の「特例制度」 | 福井県ホームページ ,新型コロナウイルスの影響により納税が困難な方へ徴収猶予の「特例制度」 新型コロナウイルスの影響により納税が困難な方へ徴収猶予の「特例制度」|福井県ホームページ
東京都,https://www.metro.tokyo.lg.jp/tosei/hodohappyo/press/2020/03/31/23.html,移転資金貸付金の対応（都市整備局事業）（第139報）｜東京都 ,新型コロナウイルスの感染拡大に伴う移転資金貸付金の対応について（都市整備局事業）（第139報） 東京都では、新型コロナウイルスの感染拡大に伴い、下記事業について、納付期限を猶予いたします。
富士市,https://www.city.fuji.shizuoka.jp/kurashi/c0604/rn2ola000002emz4.html,新型コロナウイルス感染症の影響に伴う一時的な資金の緊急貸付について | 静岡県富士市 ,新型コロナウイルス感染症の影響に伴う一時的な資金の緊急貸付について 新型コロナウイルス感染症の影響に伴う一時的な資金の緊急貸付について|静岡県富士市 新型コロナウイルス感染症の影響を踏まえ、貸付の対象世帯を低所得世帯以外に拡大し、休業や失業等により生活資金でお悩みの方々に向けた、緊急小口資金等の特例貸付が実施されます。
稚内市,https://www.city.wakkanai.hokkaido.jp/kurashi/sumaisuido/suido/osiraseryoukinka/yuyo.html,新型コロナウィルス感染症の影響に関する支払猶予について（水道・下水道・し尿）／稚内市 ,新型コロナウィルス感染症の影響に関する支払猶予について（水道・下水道・し尿） 稚内市では、新型コロナウィルス感染症拡大の影響に伴い、水道料金・下水道使用料・し尿処理手数料に関する納期限の延長（支払猶予）を行います。
大野城市,https://www.city.onojo.fukuoka.jp/s014/010/010/010/040/20200407202503.html,新型コロナウイルス感染症の影響による市営住宅の家賃の減免および徴収猶予について｜大野城市 ,例1．新型コロナウイルス感染症の影響に伴い、勤務先や自営の会社等が事業活動の縮小・休業などを行ったため、収入が減少した人（解雇、休職、倒産、休業、営業停止、売上の減少など） 例2．新型コロナウイルス感染拡大防止による小学校などの臨時休業等に伴い、家族が休暇を取得したため、収入が減少した人
蕨市,https://www.city.warabi.saitama.jp/kenko/fukushi/seikatsu/1005820.html,新型コロナウイルスの影響による休業や失業で生活資金にお困りの方へ｜蕨市公式ウェブサイト ,このたび、新型コロナウイルス感染症の影響を踏まえ、貸付の対象世帯を低所得世帯以外に拡大し、休業や失業等により生活資金でお悩みの方々に向けた、緊急小口資金等の特例貸付を実施することとなりました。 新型コロナウイルスの影響による休業や失業で生活資金にお困りの方へ 新型コロナウイルスの影響による休業や失業で生活資金にお困りの方へ｜蕨市公式ウェブサイト
軽井沢町,https://www.town.karuizawa.lg.jp/www/genre/1000100000039/index.html,農林業・商工業 | 長野県軽井沢町公式ホームページ ,中小企業者・小規模事業者への新型コロナウイルスに対する支援 新型コロナウイルスの影響による観光関係事業者への相談窓口について 新型コロナウイルス感染症対策緊急資金融資制度について
群馬県,https://www.pref.gunma.jp/houdou/g10g_00120.html,群馬県 - 【3月27日】県内事業者向け「新型コロナウイルス感染症対策　出張相談会」を開催（商政課） ,【3月27日】県内事業者向け「新型コロナウイルス感染症対策出張相談会」を開催（商政課） ファックス：「県内事業者向け新型コロナウイルス感染症対策出張相談会申込書」（PDF 県では、新型コロナウイルス感染症により経営に影響を受けている県内事業者を対象に、資金繰りや雇用等に係る相談会を県内各地（１１カ所）で開催します。 群馬県-【3月27日】県内事業者向け「新型コロナウイルス感染症対策出張相談会」を開催（商政課）
千代田区,https://www.city.chiyoda.lg.jp/koho/kenko/sekatsu/kurashi.html,千代田区ホームページ - くらしと仕事・家計に関する相談（生活困窮者自立支援制度） ,新型コロナウイルスの感染拡大を受け、4月1日（水曜日）から5月6日（水曜日）までの期間、「子どもの学習・生活支援事業」を中止することになりました。
富田林市,https://www.city.tondabayashi.lg.jp/soshiki/15/37925.html,市民窓口課での手続きについて（新型コロナウイルス感染拡大防止） - 富田林市公式ウェブサイト ,市民窓口課での手続きについて（新型コロナウイルス感染拡大防止）
栃木県,http://www.pref.tochigi.lg.jp/f02/houdou/houdou/r2_re_supplychain.html,栃木県／令和２(2020)年度サプライチェーン再構築支援補助金の募集について ,栃木県では、新型コロナウイルス感染症の影響によるサプライチェーンの毀損等による県内生産への影響低減と生産回帰を図るため、「サプライチェーン再構築支援補助金」の事業計画を募集します。
八代市,https://www.city.yatsushiro.lg.jp/list00002.html, 健康・福祉 / 八代市 ,介護保険事業者向け介護保険最新情報について（新型コロナウイルス関連）
富山市,https://www.city.toyama.toyama.jp/zaimubu/nozeika/singatakoronauirususizeinoyuuyo.html,富山市 新型コロナウイルス感染症の影響により市税の納付が困難な方に対する猶予制度について ,富山市新型コロナウイルス感染症の影響により市税の納付が困難な方に対する猶予制度について
木更津市,https://www.city.kisarazu.lg.jp/kosodate/kosodate/hoikuen/1006614.html,新型コロナウィルス感染症拡大に伴う保育所の対応について｜千葉県木更津市公式ホームページ ,新型コロナウィルス感染症対策に伴う育児休業復職期限の延長について
熊本県,https://www.pref.kumamoto.jp/kiji_31452.html, 新型コロナウイルス感染症拡大防止のための学校臨時休業に伴う放課後児童クラブの開所状況について (3月6日現在） / 熊本県 ,新型コロナウイルス感染症拡大防止のための学校臨時休業に伴う放課後児童クラブの開所状況について(3月6日現在） 新型コロナウイルス感染症拡大防止のための学校臨時休業に伴う放課後児童クラブの開所状況について(3月6日現在）/熊本県
守山市,https://www.city.moriyama.lg.jp/shokokanko/2020coronavirus_keieiryokukyokahojyoshien.html,滋賀県の「新型コロナウイルス感染症対策経営力強化補助金」への追加支援について - 滋賀県守山市役所 ,「新型コロナウイルス感染症対策経営力強化補助金」の採択を受けた事業者 滋賀県の「新型コロナウイルス感染症対策経営力強化補助金」への追加支援について 滋賀県の「新型コロナウイルス感染症対策経営力強化補助金」への追加支援について-滋賀県守山市役所
滋賀県,https://www.pref.shiga.lg.jp/ippan/kenkouiryouhukushi/chiiki/310803.html,生活福祉資金貸付制度について｜滋賀県ホームページ ,新型コロナウイルスに関連した休業等により一時的に収入が減少・途絶する方への生活福祉資金貸付制度の対応について
網走市,https://www.city.abashiri.hokkaido.jp/260fukushi/shakyou_kinkyukashitsuke.html,新型コロナウイルス感染症の影響に伴う生活資金の貸付について｜福祉・介護｜網走市 ,新型コロナウイルス感染症の影響による失業、休業等でお困りの世帯への生活資金の貸付について 新型コロナウイルス感染症の影響に伴う生活資金の貸付について｜福祉・介護｜網走市 新型コロナウイルス感染症の影響を踏まえ、貸付の対象世帯が低所得世帯以外に拡大され、休業や失業等により生活資金でお困りの方々に向けた、緊急小口資金等の特例貸付が創設されました。
和歌山県,https://www.pref.wakayama.lg.jp/prefg/010500/kenzeientyou.html,新型コロナウイルス感染症の拡大防止に伴う県税の取扱いについて | 和歌山県 ,新型コロナウイルス感染症の拡大防止に伴う県税の取扱いについて
つくば市,https://www.city.tsukuba.lg.jp/1004060/1004085.html,つくバス通学定期券の払戻しについて｜つくば市公式ウェブサイト ,新型コロナウイルス感染拡大防止のため、通学先の学校（小学校、中学校、高等学校、大学及びこれらに相当する特別支援学校などの指定を受けた学校）が臨時休校となり、通学定期券の払戻しを希望する方が対象となります。
