日野市,https://www.city.hino.lg.jp/sangyo/chusho/yuushi/1013989.html,新型コロナウイルス感染症対応運転資金融資あっせん（別枠）｜日野市公式ホームページ ,新型コロナウイルス感染症により事業経営に支障をきたしている市内中小企業者の方向けに、通常の融資あっせん制度とは別枠の融資あっせんメニューを期間限定で実施いたします。 新型コロナウイルス感染症対応運転資金融資あっせんチラシ 新型コロナウイルス感染症対応運転資金融資あっせん（別枠） 新型コロナウイルス感染症対応運転資金融資あっせん（別枠）｜日野市公式ホームページ
仙台市,https://www.city.sendai.jp/kikakushien/covid_19_2020.html,新型コロナウイルスに関する中小企業者向け情報｜仙台市 ,「せんだいE企業だより」では、企業の皆様に公的機関による企画や新型コロナウイルス感染症の影響を受けての支援制度などの情報をリアルタイムで配信しています。 新型コロナウイルスの影響による小学校等の臨時休業等に伴い、子どもの世話を行うため、契約した仕事ができなくなっている子育て世代を支援し、子供たちの健康、安全を確保します。 新型コロナウイルス感染症で影響を受ける事業者の皆様にご活用いただける仙台市支援策のパンフレットです。 新型コロナウイルス感染症により、影響を受けているまたはその恐れがある中小企業等の経営や資金繰り等に関する相談に応じています。 新型コロナウイルス感染症により、経営や資金繰りに影響を受けた中小企業者がセーフティネット保証等に関連した融資（経済変動対策資金）を利用する場合に、中小企業者が納める当初融資時の保証料を本市が全額補給します。 新型コロナウイルス感染症により影響を受けている中小企業者の方は、下記保証に関連した融資（経済変動対策資金）をご利用いただけます。 新型コロナウイルス感染症に対応した緊急経済対策支援事業一覧（4月10日時点）（PDF：1 087KB） 新型コロナウイルス感染症の影響を受けた事業者（売上が10％以上減少）の方には、採択審査における加点措置が講じられます。 新型コロナウイルス感染症への対応として、雇用調整助成金の特例措置が実施されています。助成金申請の窓口は宮城労働局になりますので、申請等については宮城労働局にお問い合わせください。 日本政策金融公庫「新型コロナウイルスに関する相談窓口」（外部サイトへリンク） 特例措置の対象事業主新型コロナウイルス感染症の影響を受ける事業主
厚生労働省 厚生労働省,https://www.mhlw.go.jp/stf/newpage_09927.html,新型コロナウイルスに伴う教育訓練給付制度に関するQ&A ,新型コロナウイルスに伴う教育訓練給付制度に関するQ&A 雇用・労働新型コロナウイルスに伴う教育訓練給付制度に関するQ&A
盛岡市,https://www.city.morioka.iwate.jp/kenkou/kenko/1029832/1030156.html,【事業者及び勤労者の方へ】新型コロナウイルス感染症の流行に伴う商工業関連支援について【4月14日更新】 ｜盛岡市公式ホームページ ,&nbsp;&nbsp;なお，新型コロナウイルス感染症の影響を踏まえ，雇用調整助成金の特例が実施されています。 &nbsp;&nbsp;盛岡市では，令和2年新型コロナウイルス感染症の流行に伴い，市内事業者や労働者を対象とした経済相談窓口を開設しております。窓口の設置場所や支援内容は次のとおりです。 &nbsp;&nbsp;経済産業省では，今般の新型コロナウイルス感染症の流行により，影響を受けるまたは，その恐れがある中小企業・小規模事業者を対象として「新型コロナウイルスに関する経営相談窓口」を設置し，経営上の相談を受け付けております。 &nbsp;また，新型コロナウイルス感染症に係る時間外労働等改善助成金（テレワークコース，職場意識改善コース）の特例的なコースの申請の受付が開始されています。 &nbsp;新型コロナウイルス感染症の影響により，全国の中小企業・小規模事業者の資金繰りが逼迫していることを踏まえ，既に実施しているセーフティネット保証に加えて，危機関連保証が実施されることとなりました。 【事業者及び勤労者の方へ】新型コロナウイルス感染症の流行に伴う商工業関連支援について【4月3日更新】 【事業者及び勤労者の方へ】新型コロナウイルス感染症の流行に伴う商工業関連支援について【4月3日更新】｜盛岡市公式ホームページ その他の新型コロナウイルス感染症に係る経営相談窓口のご案内 中小企業庁では，新型コロナウイルス感染症の流行を受け，同感染症の流行により経営に悪影響が生じている事業者への支援を目的として，小規模事業者持続化補助金の制度設計の内容を一部見直しております。 岩手県では新型コロナウイルス感染症に関わる事業者向け金融相談窓口を設置しております 岩手県制度融資「新型コロナウイルス感染症対策資金」に必要となる認定書は，こちらをご利用ください。 新型コロナウイルス感染症に関わる事業者向け相談窓口の開設について 新型コロナウイルス感染症の影響により納税が困難な方はご相談ください。 新型コロナウイルス感染症の影響による売上減少の証明書（小規模事業者持続化補助金関連）発行窓口の開設について 盛岡市における新型コロナウイルス感染症の経済相談窓口について
上田市,https://www.city.ueda.nagano.jp/soshiki/shoko/22398.html,新型コロナウイルス感染拡大に関連して各機関が実施している事業者等向け支援策について - 上田市ホームページ ,新型コロナウイルス感染拡大に関連して各機関が実施している事業者等向け支援策について 新型コロナウイルス感染拡大に関連して各機関が実施している事業者等向け支援策について-上田市ホームページ 新型コロナウイルス感染拡大に関連して各機関が実施している事業者等向け支援策の情報を掲載します。 新型コロナウイルス感染症にかかる衛生環境激変特別貸付（国民生活事業）
熊本県,https://www.pref.kumamoto.jp/kiji_31850.html, 新型コロナウイルス感染症の影響により納税が困難な方に対する県税の猶予制度 / 熊本県 ,新型コロナウイルス感染症の影響により納税が困難な方に対する県税の猶予制度 新型コロナウイルス感染症の影響により納税が困難な方に対する県税の猶予制度/熊本県
広島県,https://www.pref.hiroshima.lg.jp/site/kyouiku/06senior-2nd-syougakukin-kinkyu-corona.html,広島県高等学校等奨学金（緊急募集）について（新型コロナウイルス感染症対応） | 広島県教育委員会 ,≪新型コロナウイルス感染症に対応した特例措置では≫ 広島県高等学校等奨学金（緊急募集）について（新型コロナウイルス感染症対応）
早島町,http://www.town.hayashima.lg.jp/emergency/1584949618686.html,新型コロナウイルス感染症の影響により納税が困難な方に対する地方税における猶予制度について／早島町ホームページ ,新型コロナウイルス感染症に納税者（ご家族を含む。）がり患された場合のほか、新型コロナウイルス感染症に関連するなどして以下のようなケースに該当する場合は、猶予制度がありますので、税務課にご相談ください（徴収の猶予：地方税法第15条）。 新型コロナウイルス感染症の影響により、地方税を一時に納付することができない場合、申請による換価の猶予制度がありますので、税務課にご相談ください（申請による換価の猶予：地方税法第15条の6）。 新型コロナウイルス感染症の影響により納税が困難な方に対する地方税における猶予制度について 新型コロナウイルス感染症の影響により納税が困難な方に対する地方税における猶予制度について／早島町ホームページ
宮城県,http://www.pref.miyagi.jp/soshiki/nosin/keieisodan.html,「新型コロナウイルスに関する農業経営相談窓口」の設置について - 宮城県公式ウェブサイト ,「新型コロナウイルスに関する農業経営相談窓口」の設置について 「新型コロナウイルスに関する農業経営相談窓口」の設置について-宮城県公式ウェブサイト
高知県,https://www.pref.kochi.lg.jp/soshiki/110501/2020031700036.html,新型コロナウイルス感染症の影響により県税の納税が困難な方へ | 高知県庁ホームページ ,新型コロナウイルス感染症の影響により県税の納付が困難な方には猶予制度があります。 新型コロナウイルス感染症の影響により県税の納税が困難な方へ 新型コロナウイルス感染症の影響により県税の納税が困難な方へ|高知県庁ホームページ
穴水町,http://www.town.anamizu.ishikawa.jp/covid-19.html,新型コロナウイルス感染症に関する情報 ,新型コロナウイルスに係る電話相談窓口
匝瑳市,https://www.city.sosa.lg.jp/page/page003091.html,市民の皆様へ市長からのメッセージ&nbsp;|&nbsp;匝瑳市公式ホームページ ,新型コロナウイルス感染症で影響を受ける事業者への支援策 新型コロナウイルス感染症の拡大防止のため縮小実施、延期となる母子保健事業（健診、相談など） 新型コロナウイルス感染症対策に伴う市立幼稚園、小・中学校の臨時休業などについて
千代田区,https://www.city.chiyoda.lg.jp/koho/kuse/koho/pressrelease/r2/r203/20200302.html,千代田区ホームページ - 緊急経営支援特別資金の創設～新型コロナウイルス感染症対応～（令和2年3月2日配信） ,千代田区ホームページ-緊急経営支援特別資金の創設～新型コロナウイルス感染症対応～（令和2年3月2日配信） 緊急経営支援特別資金の創設～新型コロナウイルス感染症対応～（令和2年3月2日配信）
栃木県,http://www.pref.tochigi.lg.jp/f03/koronarishi.html,栃木県／新型コロナウイルス感染症緊急対策資金利子補給事業の御案内 ,令和２(2020)年３月２日から令和３(2021)年３月31日の間に県制度融資「新型コロナウイルス感染症緊急対策資金」の融資実行を受けた中小企業 新型コロナウイルス感染症緊急対策資金利子補給事業の御案内 栃木県／新型コロナウイルス感染症緊急対策資金利子補給事業の御案内 県では、新型コロナウイルス感染症により経営が悪化した中小企業を支援するため、栃木県制度融資「新型コロナウイルス感染症緊急対策資金」の利用に伴う利子補給事業を実施します。 融資申込時、「新型コロナウイルス感染症緊急対策資金利子補給金交付申請書兼請求書」（以下、「申請書兼請求書」と言う。）を融資申込先の金融機関宛て御提出ください。
新篠津村,https://www.vill.shinshinotsu.hokkaido.jp/hotnews/detail/00000726.html,新篠津村中小企業新型コロナウイルス感染症対策特別融資制度の創設について | 新篠津村 ,新篠津村中小企業新型コロナウイルス感染症対策特別融資制度の創設について 新篠津村中小企業新型コロナウイルス感染症対策特別融資制度の創設について|新篠津村
愛媛県,https://www.pref.ehime.jp/h37100/sikin/index.html,愛媛県庁／水産制度資金 ,日本政策金融公庫「新型コロナウイルスに関する相談窓口」（外部サイトへリンク）［令和2年2月27日］
熊本県,https://www.pref.kumamoto.jp/kiji_31524.html, 新型コロナウイルス感染拡大に伴う農林漁業者向け金融支援制度の創設について / 熊本県 ,&nbsp;&nbsp;新型コロナウイルス感染拡大に伴う農林漁業者向け金融支援制度の創設について 新型コロナウイルス感染拡大に伴う農林漁業者向け金融支援制度の創設について 新型コロナウイルス感染拡大に伴う農林漁業者向け金融支援制度の創設について/熊本県 資金名新型コロナウイルス対策緊急支援資金（県独自分）
金融庁,https://www.fsa.go.jp/ordinary/coronavirus202001/press.html,新型コロナウイルス感染症関連情報：金融庁 ,〇新型コロナウイルス感染症の影響拡大を踏まえた事業者の資金繰り支援について（要請）（3月24日） 金融庁では、新型コロナウイルス感染症について、債務の条件変更・新規融資など、事業者の実情に応じた万全の対応を金融機関に要請し、事業者への資金繰り支援の促進を当面の検査・監督の最重点事項として、特別ヒアリング等で、金融機関の取組状況を確認しております。
島根県,https://www.pref.shimane.lg.jp/industry/norin/nougyo/sikin/R2shingatakorona.html,島根県：令和２年新型コロナウィルス感染症対策資金のご案内について（トップ / しごと・産業 / 農林業 / 農業振興 / 農業制度資金） ,島根県：令和２年新型コロナウィルス感染症対策資金のご案内について（トップ/しごと・産業/農林業/農業振興/農業制度資金）
沖縄県,https://www.pref.okinawa.jp/site/shoko/keiei/kinyu/yuushiseido.html,沖縄県の融資制度／沖縄県 ,新型コロナウイルス感染症で影響を受けた事業者に対する支援等について&nbsp;
農林水産省,https://www.maff.go.jp/kyusyu/202003.html,新型コロナウイルスに関する情報：九州農政局 ,&nbsp;今回の新型コロナウイルス感染症による影響の広がりや深刻さを踏まえ、日本政策投資銀行による危機対応業務を開始し、企業の資金繰りやサプライチェーンの再編等を支援しています。 &nbsp;特別利子補給制度&nbsp;新型コロナウイルス感染症特別貸付の箇所をご覧下さい。（補給対象上限：1億円） &nbsp;特別利子補給制度&nbsp;新型コロナウイルス感染症特別貸付の箇所をご覧下さい。（補給対象上限：3 000万円） 1.新型コロナウイルス感染症特別貸付制度の創設 新型コロナウイルス感染症により影響を受けられた農業者の方について、農業保険（収入保険、農業共済）の保険料等の支払い期限の延長等を行います。 新型コロナウイルス感染症による小学校休業等対応助成金について 新型コロナウイルス感染症の影響に伴い、休校となった小学校等に通う子供等のお世話をする保護者である労働者に対し、有給休暇（労基法上の年次有給休暇を除く）を取得させた農林漁業の経営体も本助成金の対象となります。助成金の詳細やお問い合わせ、申請については以下のリンク先をご覧ください。
平塚市,http://www.city.hiratsuka.kanagawa.jp/kigyo/page-c_01650.html,新型コロナウイルス感染症に対する本市の中小企業の相談窓口 | 平塚市 ,新型コロナウイルス感染症に対する本市の中小企業の相談窓口 新型コロナウイルス感染症に対する本市の中小企業の相談窓口|平塚市
さくら市,https://www.city.tochigi-sakura.lg.jp/site/shingatakorona/kogakudou.html,新型コロナウイルス感染症防止のための学校の臨時休業に伴う学童対応について - さくら市ホームページ ,新型コロナウイルス感染症の影響による資金の特例貸付 新型コロナウイルス感染症防止のための学校の臨時休業に伴う学童対応について 新型コロナウイルス感染症防止のための学校の臨時休業に伴う学童対応について-さくら市ホームページ
文京区,https://www.city.bunkyo.lg.jp/kyoiku/kyoiku/corona.html,文京区 新型コロナウイルス感染症に対する学校及び教育関連施設の今後の対応について（4月16日更新） ,区立小・中学校及び教育関連施設につきましては、新型コロナウイルスの感染拡大を極力防ぎ、児童・生徒の命と健康を守るため、3月2日（月曜日）より休校措置等を行ってまいりました。
神奈川県,https://www.pref.kanagawa.jp/docs/jf2/coronavirus2020/index.html,新型コロナウイルス感染症の流行により影響を受けている事業者の皆様へ - 神奈川県ホームページ ,(ア)新型コロナウイルス感染症に係る時間外労働等改善助成金（テレワークコース）の特例【厚生労働省】 ※4月1日から、全国の全業種において新型コロナウイルス感染症の影響を受ける事業者に対して、次の内容で特例措置の拡大を行います。 このページでは、新型コロナウイルス感染症の流行により影響を受けている事業者（個人事業主やフリーランスを含みます）に向けた支援策を集約し、情報提供しています。 ア）新型コロナウイルス対策特別融資（危機関連保証別枠） イ）新型コロナウイルス対策特別融資（4号別枠） エ新型コロナウイルス感染症に係る時間外労働等改善助成金（テレワークコース）の特例＜国＞ オ新型コロナウイルス感染症に係る時間外労働等改善助成金（職場意識改善コース）の特例＜国＞ テレワークの導入は、ワーク・ライフ・バランスの実現（仕事と生活の調和）、人材確保（優秀な社員の確保、雇用継続）や生産性の向上が期待できるだけでなく、今回の新型コロナウイルスのような感染症拡大防止や災害時における事業継続にも効果を発揮します。 助成率は、大企業は2分の1、中小企業は3分の2です。支給限度日数は、1年間で100日です。新型コロナウイルス感染症の影響を踏まえた特例措置により、休業等の初日が令和2年1月24日から7月23日までの場合に適用します。 商工組合中央金庫が、新型コロナウイルス感染症による影響を受け業況が悪化した事業者に対し、危機対応融資による資金繰り支援を実施します。 新型コロナウイルスの影響による休業等を理由に、一時的に資金が必要な個人事業主やフリーランスの方へ緊急の貸付を実施します。また、万が一、失業されて生活に困窮された個人事業主やフリーランスの方には、生活の立て直しのための安定的な資金を貸し付けます。 新型コロナウイルスの影響を受け、休業等により収入の減少があり、緊急かつ一時的な生計維持のための貸付を必要とする世帯（※従来の低所得世帯等に限定した取扱を拡大） 新型コロナウイルスの流行により影響を受ける県内中小企業に対する「経営相談窓口」を設置します 新型コロナウイルス感染症により納税が困難な状況となった方は、まずは、県税事務所にご相談ください。 新型コロナウイルス感染症に関する特別相談窓口 新型コロナウイルス感染症の影響により国税を一時に納付することが困難な場合には、税務署に申請することにより、換価の猶予が認められることがあります。また、次の事情がある場合には、納税の猶予が認められることがあります。 新型コロナウイルス感染症の感染拡大防止の観点から、申告所得税（及び復興特別所得税）、贈与税および個人事業者の消費税（及び地方消費税）の申告期限・納付期限が令和2年4月16日（木曜日）まで延長されました。 新型コロナウイルス感染症の流行により影響を受けている事業者の皆様へ 新型コロナウイルス感染症対策として、新たにテレワークを導入したい中小企業事業主を支援するため、成果目標の達成状況に応じた基準を無くすことで、実施計画書や支給申請書の作成に係る負担が軽減された特例的なコースが設けられています。 新型コロナウイルス感染症対策として、特別休暇の規定を整備した中小企業事業主を支援するため、特例的なコースが設けられています。 日本政策金融公庫による「新型コロナウイルス感染症特別貸付」や「特別利子補給制度」、「小規模事業者経営改善資金融資（新型コロナウイルス対策マル経）」などがあります。詳細は下記ホームページをご確認ください。 日本政策金融公庫新型コロナウイルスに関する相談窓口 県内IT企業においては、新型コロナウイルスへの対応のため、次のようなテレワーク導入支援を行っています。(企業の名称順）
大空町,http://www.town.ozora.hokkaido.jp/docs/2020022800011/index.html,新型コロナウイルスに関する緊急速報 | 大空町 ,◆コロナウイルス感染症相談窓口
錦町,http://www.nishiki-machi.com/docs/2020040600013/index.html,新型コロナウイルス感染症の感染拡大により影響を受けた中小企業・個人事業主の皆様を支援します | 錦町 ,新型コロナウイルス感染症の感染拡大により影響を受けた中小企業・個人事業主の皆様を支援します2020年4月7日 新型コロナウイルス感染症の感染拡大により影響を受けた中小企業・個人事業主の皆様を支援します|錦町
弥富市,https://www.city.yatomi.lg.jp/kurashi/1000103/1003655.html,新型コロナウィルス感染症の影響により国民健康保険税、後期高齢者医療保険料、介護保険料、国民年金保険料の納付が困難な方へ｜弥富市公式ホームページ ,新型コロナウィルス感染症の影響により各種保険税、保険料の納付が困難な場合につきましては、以下の窓口へご相談ください。
丸森町,http://www.town.marumori.miyagi.jp/syoukokanko/shoukou/COVID-19_business_support.html,丸森町 【新型コロナウイルス】事業者の皆様向け支援制度について ,【新型コロナウイルス】事業者の皆様向け支援制度について 丸森町【新型コロナウイルス】事業者の皆様向け支援制度について
会津若松市,https://www.city.aizuwakamatsu.fukushima.jp/docs/2020031200017/index.html,新型コロナウィルス感染症に関連した事業者支援について | 会津若松市 ,この制度は、中小企業信用保険法第２条第６項の規定に基づき、新型コロナウィルス感染症の影響により売り上げが減少した中小企業の資金繰りを支援するために、一般保証、セーフティネット保証とは別枠で保証を行う制度です。 新型コロナウィルス感染症に関連した事業者支援について2020年4月8日 新型コロナウィルス感染症に関連した事業者支援について|会津若松市 経済産業省等が実施している新型コロナウィルス感染症拡大の影響を受けている事業者の方への支援策についてご案内します。
経済産業省 経済産業省,https://www.meti.go.jp/information/publicoffer/kobo/2020/k200317002.html,令和元年度マスク生産設備導入支援事業費補助金に係る補助事業者の公募について （METI/経済産業省） ,本事業は、経済産業省及び厚生労働省が発出した「新型コロナウイルスに関連した感染症の発生に伴うマスクの安定供給について」に資する事業です。
熊本県,https://www.pref.kumamoto.jp/kiji_31533.html, 住宅宿泊事業者の皆様への新型コロナウイルス感染症に関する支援等について / 熊本県 ,住宅宿泊事業者の皆様への新型コロナウイルス感染症に関する支援等について 住宅宿泊事業者の皆様への新型コロナウイルス感染症に関する支援等について/熊本県
