稚内市,https://www.city.wakkanai.hokkaido.jp/sangyo/shoko/shien/safe_hosyoseido4.html,新型コロナウイルス感染症に関する中小企業・労働者向け支援について／稚内市 ,商工中金が、新型コロナウイルス感染症による影響を受け業況が悪化した事業者に対し、危機対応融資による資金繰り支援を実施します。 新型コロナウイルスの影響により、休職を余儀なくされた道内に居住する中小企業従業員（育児・介護休業者を含む）、非正規労働者、季節労働者及び離職者を支援するため、一定期間、勤労者福祉資金の保証料を免除しています。 新型コロナウイルス感染症に関する中小企業・労働者向け支援について 新型コロナウイルス感染症に関する中小企業・労働者向け支援について／稚内市 新型コロナウイルス感染症の影響を受け、休業等により収入の減少があり、緊急かつ一時的な生計維持のための貸付を必要とする世帯に対し、原則として一世帯につき１回限り10万円以内の小口資金の貸付を行っています。 新型コロナウイルス感染症の影響を踏まえた特例措置 新型コロナウイルス関連肺炎の流行による直接的又は間接的な影響を受けた中小企業者等について、中小企業総合振興資金「経営環境変化対応貸付【認定企業】」を適用し、中小企業者等に係る資金繰りを支援します。 新型コロナウイルス関連肺炎の流行に伴い、短期的な運転資金を供給することによって、喫緊の資金繰りを支援し、中小企業・小規模事業者の事業継続を後押しする「緊急短期資金保証制度」の取り扱いを開始しています。
厚生労働省 厚生労働省,https://www.mhlw.go.jp/stf/seisakunitsuite/bunya/koyou_roudou/koyou/kyufukin/pageL07_00002.html,新型コロナ休暇支援｜厚生労働省 ,支給要件、申請手続等のご案内（新型コロナウイルス感染症による小学校休業等対応助成金のご案内） 新型コロナウイルス感染症による小学校休業等対応助成金・支援金の支給要領の改正について 新型コロナ休暇支援｜厚生労働省 雇用保険被保険者以外用（新型コロナウイルス感染症による小学校休業等対応助成金） 雇用保険被保険者用（新型コロナウイルス感染症小学校休業等対応コース）
中小企業基盤整備機構,https://j-net21.smrj.go.jp/news/tsdlje0000009w4l.html,経産省 コロナ対策無利子融資や現金給付で中小企業の相談受付 | 支援 | J-Net21[中小企業ビジネス支援サイト] ,経済産業省は、新型コロナウイルス感染症緊急経済対策に伴う令和2年度補正予算案の閣議決定を受け、これまでの資金繰りに関する相談に加えて「中小企業金融・給付金相談窓口」で給付金関係の相談を受け付ける。 経産省コロナ対策無利子融資や現金給付で中小企業の相談受付 経産省コロナ対策無利子融資や現金給付で中小企業の相談受付|支援|J-Net21[中小企業ビジネス支援サイト]
深谷市,https://www.city.fukaya.saitama.jp/business/shokougyo/syokogyohenosien/1585263726547.html,渋沢まごころ資金(市制度融資小口資金特別枠)／深谷市ホームページ ,新型コロナウイルス感染症に係る事業者支援について 深谷市は、新型コロナウイルス感染症の影響により、売上高が減少している事業者を支援するため、既存の市制度融資小口資金に特別枠を創設しました。
大分県,https://www.pref.oita.jp/soshiki/14040/sodanmadoguti1.html,新型コロナウイルスの流行に伴う経営・金融相談窓口の開設について - 大分県ホームページ ,新型コロナウイルスの流行に伴う経営・金融相談窓口の開設について 新型コロナウイルスの流行に伴う経営・金融相談窓口の開設について-大分県ホームページ
沖縄県,https://www.pref.okinawa.jp/site/shoko/keiei/kinyu/safety4.html,中小企業信用保険法第２条第５項第４号（セーフティネット保証４号）の規定に基づく指定について／沖縄県 ,新型コロナウイルス感染症で影響を受けた事業者に対する支援等について
東京都,https://www.metro.tokyo.lg.jp/tosei/hodohappyo/press/2020/03/16/12.html,中小企業従業員向けの生活資金融資を実施（第89報）｜東京都 ,新型コロナウイルス感染症に対応した中小企業従業員向けの生活資金融資を実施します（第89報） 東京都では、新型コロナウイルス感染症等の影響による休業での収入減等に備え、中小企業の従業員向けに実質無利子の融資を行います。
山口県,https://www.pref.yamaguchi.lg.jp/cms/a16300/kinyuu/202002210001_sp.html,山口県/経営金融課/金融支援班・新型コロナウイルス感染症対策(金融支援) ,新型コロナウイルス感染症により、一時的な資金需要が生じている中小企業者等について、経営の安定のために必要となる短期の運転資金を融資 新型コロナウイルス感染症に関する在宅勤務・テレワーク相談窓口を設置 県中小企業制度融資による金融支援（「新型コロナウイルス感染症対応短期支援資金」）
今帰仁村,https://www.nakijin.jp/pagtop/topics/1661.html,新型コロナウィルス感染症防止のための臨時休業期間について（4月15日更新）／今帰仁村 ,新型コロナウィルス感染症防止のための臨時休業期間について（4月6日更新）
滋賀県,https://www.pref.shiga.lg.jp/ippan/shigotosangyou/shigoto/310828.html,新型コロナウイルス感染症の影響により雇用に影響を受けている事業者の皆様へ｜滋賀県ホームページ ,新型コロナウイルス感染症の影響により雇用に影響を受けている事業者の皆様へ 新型コロナウイルス感染症の影響により雇用に影響を受けている事業者の皆様へ｜滋賀県ホームページ 新型コロナウイルス感染症の発生に伴う労働相談窓口について
蒲郡市,https://www.city.gamagori.lg.jp/unit/kankoshoko/corona-hojyokin.html,【新型コロナウイルス感染症対策】中小企業者向け信用保証料補助・利子補給制度のご紹介（補助対象融資を追加しました） - 愛知県蒲郡市公式ホームページ ,【制度周知チラシ】新型コロナウイルス対策信用保証料・利子補給補助金について[PDFファイル／355KB] 【制度概要チラシ】新型コロナウイルス対策信用保証料・利子補給補助金について[PDFファイル／345KB] 【新型コロナウイルス感染症対策】中小企業者向け信用保証料補助・利子補給制度のご紹介（補助対象融資を追加しました） 【新型コロナウイルス感染症対策】中小企業者向け信用保証料補助・利子補給制度のご紹介（補助対象融資を追加しました）-愛知県蒲郡市公式ホームページ オ愛知県経済環境適応資金融資制度新型コロナウイルス感染症対策緊急つなぎ資金
吹田市,https://www.city.suita.osaka.jp/home/soshiki/div-toshimiryoku/chiikikeizai/soudann.html,吹田市｜【事業所の皆様へ】新型コロナウイルス感染症に関する情報（相談窓口の設置、緊急資金の創設等）について ,【事業所の皆様へ】新型コロナウイルス感染症に関する支援情報（相談窓口、融資等）について この認定を受けることで、大阪府の「新型コロナウイルス感染症対策資金」融資に申込みができます。 厚生労働省「新型コロナウイルス感染症による小学校休業等対応助成金」 厚生労働省では、「新型コロナウイルス」に関連する雇用・労働についての情報を提供しています。 吹田市｜【事業所の皆様へ】新型コロナウイルス感染症に関する情報（相談窓口の設置、緊急資金の創設等）について 新型コロナウイルス感染症に関する対応として臨時休業等をした小学校等に通う子ども 新型コロナウイルス感染症に関する相談窓口の設置について 経済産業省において、新型コロナウイルス感染症で影響を受ける事業者の皆様にご活用いただける支援策がパンフレットにまとめられました。
平塚市,http://www.city.hiratsuka.kanagawa.jp/kenko/page99_00038.html,新型コロナウイルス感染症に関するその他の関連情報 | 平塚市 ,学校施設の開放や、企業支援・労働相談など、コロナウイルスに関連した平塚市の取り組みや対応などを掲載しています。
新見市,https://www.city.niimi.okayama.jp/important/important_detail/index/292.html,新型コロナウイルス感染症の影響により納税が困難な方へ徴収の猶予制度があります | 重要なお知らせ | 新見市 | 岡山県新見市 公式ホームページ ,新型コロナウイルス感染症の影響により納税が困難な方へ徴収の猶予制度があります 新型コロナウイルス感染症の影響により納税が困難な方へ徴収の猶予制度があります|重要なお知らせ|新見市|岡山県新見市公式ホームページ
札幌市,https://www.city.sapporo.jp/kinkyu/seikatsushien/202003/index.html,生活支援ガイド／札幌市 ,〇新型コロナ感染症の影響による労働相談（解雇・休業関係など）窓口 各種資金について、貸付けを受けた方が、新型コロナウイルス感染症の影響により支払期日に償還を行うことが著しく困難になった場合には、償還金の支払いを猶予する制度があります。 新型コロナウイルスの影響を受け、休業や収入の減少、失業等により生活資金にお困りの方 新型コロナウイルス感染症の影響を踏まえた生活福祉資金貸付制度における緊急小口資金・総合支援資金の特例貸付を受けた方
高野町,https://www.town.koya.wakayama.jp/kurashi/korona/12483.html,高野町 | 新型コロナウイルスの影響による町税の猶予制度について ,※財務省ホームページ「新型コロナウイルス感染症緊急経済対策における税制上の措置」（案）総務省ホームページ お知らせ新型コロナウイルスの影響による町税の猶予制度について 新型コロナウイルスの影響による町税の猶予制度について 新型コロナウイルス感染症の影響により、町税を一時に納付することができない場合、申請による換価の猶予制度がありますので、税務課にご相談ください。 新型コロナウイルス感染症の影響により納税が困難な方には猶予制度があります。(詳細はこちらをクリック) 高野町|新型コロナウイルスの影響による町税の猶予制度について
大井町,https://www.town.oi.kanagawa.jp/soshiki/17/corona-kyuuhu.html,新型コロナウイルス感染症関係の給付金などの詳細は未定です - 神奈川県大井町ホームページ ,新型コロナウイルス感染症関係の給付金の詳細は未定です
府中市,https://www.city.fuchu.tokyo.jp/kyoiku/gako/kyushoku/20200403.html,新型コロナウイルス感染症に伴う臨時休校にかかる学校給食費（4月分）の取扱いについて　東京都府中市ホームページ ,新型コロナウイルス感染症に伴う臨時休校にかかる学校給食費（4月分）の取扱いについて
福島県,http://www.pref.fukushima.lg.jp/sec/21025a/kinkyukoguchishikintou.html,新型コロナウイルス感染症の影響による休業等に関する生活福祉資金（緊急小口資金等）特例貸付について - 福島県ホームページ ,新型コロナウイルス感染症の影響による休業等に関する生活福祉資金（緊急小口資金等）特例貸付について 新型コロナウイルス感染症の影響による休業等に関する生活福祉資金（緊急小口資金等）特例貸付について-福島県ホームページ 新型コロナウイルス感染症の影響による休業等に関する生活福祉資金（緊急小口資金等）特例貸付の受付について 新型コロナウイルス感染症発生の影響による休業や失業等により、一時的に収入が減少した世帯を対象として、生活福祉資金貸付制度の福祉資金（緊急小口資金）及び総合支援資金（生活支援費）について特例貸付を実施します。
神奈川県,https://www.pref.kanagawa.jp/docs/m6c/prs/r4725790.html,新型コロナウイルス感染症により事業活動に影響を受けている中小企業者の皆さまへの支援を拡大します！ - 神奈川県ホームページ ,ホーム&gt;神奈川県記者発表資料&gt;新型コロナウイルス感染症により事業活動に影響を受けている中小企業者の皆さまへの支援を拡大します！ 新型コロナウイルス感染症により事業活動に影響を受けている中小企業者の皆さまへの支援を拡大します！ 新型コロナウイルス感染症により事業活動に影響を受けている中小企業者の皆さまへの支援を拡大します！-神奈川県ホームページ
厚生労働省 厚生労働省,https://www.mhlw.go.jp/stf/newpage_10605.html,新型コロナウイルス感染症による小学校休業等対応助成金・支援金の延長について ,プレスリリース新型コロナウイルス感染症による小学校休業等対応助成金・支援金の延長について ・個人で業務委託契約等で仕事をされている方向けの支援金制度（新型コロナウイルス感染症による小学校休業等支援金） ・正規雇用・非正規雇用を問わない助成金制度（新型コロナウイルス感染症による小学校休業等対応助成金） 厚生労働省では、今般の新型コロナウイルス感染症に係る小学校等の臨時休業等により仕事を休まざるをえなくなった保護者の皆さんを支援するため、 新型コロナウイルス感染症による小学校休業等対応助成金・支援金の延長について 新型コロナウイルス感染症による小学校休業等対応助成金・支援金・・・別紙
船橋市,https://www.city.funabashi.lg.jp/jigyou/shoukou/002/corona-jigyosha.html,新型コロナウィルス感染症に関する中小企業者（農林漁業者を含む）・労働者への支援｜船橋市公式ホームページ ,&nbsp;事業活動の縮小を余儀なくされた事業主が、一時的な雇用調整（休業、教育訓練または出向）を実施することによって、従業員の雇用を維持した場合に助成されます。新型コロナ感染症対応への特例措置として対象事業者を拡大しています。 厚生労働省では、今般の新型コロナウイルス感染症に係る小学校等の臨時休業等により影響を受ける労働者を支援するため、労働者を有給で休ませる企業に対し助成する仕組みを設けることとしており、助成金が創設されます。 新型コロナウィルス感染症に関する中小企業者・労働者への支援をご案内します。 新型コロナウィルス感染症に関する中小企業者（農林漁業者を含む）・労働者への支援 新型コロナウィルス感染症に関する中小企業者（農林漁業者を含む）・労働者への支援｜船橋市公式ホームページ 新型コロナウィルス感染症の影響を受けている中小企業・小規模事業者の皆さまからの経営に関するご相談を受け付けています。 新型コロナウイルスの影響による小学校等の臨時休業等に伴い、子どもの世話を行うため、契約した仕事ができなくなっている子育て世代を支援し、子どもたちの健康、安全を確保するための対策を実施します。 新型コロナウイルス感染症で影響を受けている事業者の皆様の相談を受け付けています。政府や自治体などの支援策を紹介します。お気軽に経営指導員までご相談ください。 日本政策金融公庫が新型コロナウイルス感染症に関する特別相談窓口を開設し、セーフティネット貸付の要件を緩和し、支援対象を今後の影響が懸念される事業者にまで拡大します。 経済産業省では、新型コロナウイルス感染症で影響を受ける事業者の皆様にご活用いただける支援策（資金繰り・設備投資・販路開拓・経営環境の整備等）をパンフレットにまとめています。 経済産業省は、今般の新型コロナウイルスの発生により、影響を受ける、またはそのおそれがある中小企業・小規模事業者を対象に、金融関係の相談を受け付ける「中小企業金融相談窓口」を開設します。
青梅市,https://www.city.ome.tokyo.jp/soshiki/23/19405.html,新型コロナウイルス感染症の影響により廃棄物処理手数料の納付が困難な事業主の方へ - 東京都青梅市公式ホームページ ,新型コロナウイルス感染症の影響により廃棄物処理手数料の納付が困難な事業主の方へ 新型コロナウイルス感染症の影響を受けた事業者で、廃棄物処理手数料の納付が困難な場合は清掃リサイクル課へご相談ください。
中間市,https://www.city.nakama.lg.jp/sangyo/shokogyo/corona_tyusyoushien.html, ,「新型コロナウイルス感染症特別貸付」もしくは「危機対応融資」と「特別利子補給制度」を併用することで、実質的な無利子を実現します。 「時間外労働等改善助成金」(※令和2年4月1日以降は「働き方改革推進支援補助金」に名称変更予定）に新型コロナウイルス感染症対策を目的とした取組を行う事業主を支援する特例コースを時限的に設けます。 【市内事業者の皆様へ】新型コロナウイルス感染症拡大に伴う中小企業者支援について 中間市／【市内事業者の皆様へ】新型コロナウイルス感染症拡大に伴う中小企業者支援について 今般の新型コロナウイルス感染症に係る小学校等の臨時休業等により影響を受ける労働者を支援するため、労働者を有給で休ませる企業に対し助成する仕組みです。 商工組合中央金庫が、新型コロナウイルス感染症による影響を受け業績が悪化した事業者に対し、危機対応融資による資金繰り支援を実施します。 新型コロナウイルスの影響により売上が前年比50％以上減少している事業者に対し、法人最大200万円、個人事業者等最大100万円を給付します。 新型コロナウイルス感染症の発生により、一時的な業況悪化から資金繰りに支障をきたしている旅館業、飲食店業及び喫茶店営業を営む方を対象にした貸付です。 新型コロナウイルス感染症特別相談窓口【商工中金】（外部サイトへリンク） 日本政策金融公庫が、新型コロナウイルス感染症による影響を受け業績が悪化した事業者（フリーランスを含む）に対し、融資枠別枠の制度を創設しました。 日本政策金融公庫が新型コロナウイルスに関する特別相談窓口を開設し、セーフティネット貸付の要件を緩和します。
福岡県,https://www.pref.fukuoka.lg.jp/contents/200311shiensaku.html,新型コロナウイルスに関する農林漁業者の相談窓口の開設と支援制度について - 福岡県庁ホームページ ,新型コロナウイルスに関する農林漁業者の相談窓口の開設について 新型コロナウイルスに関する農林漁業者の相談窓口の開設について-福岡県庁ホームページ
和歌山県,https://www.pref.wakayama.lg.jp/prefg/060300/gyoumu/kinyuu/sangyoushien.html,和歌山県中小企業融資制度のご案内 | 和歌山県 ,経済産業省において、新型コロナウイルスで影響を受けている事業者向けに各種支援策を取りまとめたパンフレットが作成されました。
神奈川県,https://www.pref.kanagawa.jp/docs/m6c/prs/r3217920.html,新型コロナウイルスの流行により事業活動に影響を受けている中小企業の皆さまに金融支援を実施します - 神奈川県ホームページ ,ホーム&gt;神奈川県記者発表資料&gt;新型コロナウイルスの流行により事業活動に影響を受けている中小企業の皆さまに金融支援を実施します 新型コロナウイルスの流行により事業活動に影響を受けている中小企業の皆さまに金融支援を実施します 新型コロナウイルスの流行により事業活動に影響を受けている中小企業の皆さまに金融支援を実施します-神奈川県ホームページ 新型コロナウイルスの流行により事業活動に影響を受けている県内中小企業の皆様を支援するため、「売上・利益減少対策融資」の融資対象を追加します。2月7日（金曜日）より、経営相談窓口や制度融資取扱金融機関で、融資相談の受付を開始します。
川西市,https://www.city.kawanishi.hyogo.jp/kurashi/kodomo/1010345/index.html,新型コロナウイルス感染症拡大に伴う市立保育所・認定こども園での保育料・育児休業からの復職などの取扱いについて｜川西市 ,新型コロナウイルス感染症拡大に伴う市立保育所・認定こども園での保育料・育児休業からの復職などの取扱いについて 新型コロナウイルス流行の影響により、入所後に育児休業からの復職や、求職活動が困難な方は、市が自粛要請をしている間は期間の延長をさせていただきますので、幼児教育保育課までご相談ください。
沖縄県,https://www.pref.okinawa.jp/site/kodomo/shonenkodomo/seishonen/h30kouryuuouenhojyojigyou.html,企業・団体における交流応援補助事業のご案内について／沖縄県 ,新型コロナウイルス感染症で影響を受けた事業者に対する支援等について
湯河原町,https://www.town.yugawara.kanagawa.jp/life/jougesuidou/p04470.html,湯河原町 | 新型コロナウイルス感染症の影響を踏まえた水道料金・下水道使用料の支払い猶予について ,新型コロナウィルス感染症の影響を踏まえた生活福祉資金貸付制度（緊急小口資金・総合支援資金の特例貸付）の対象者をはじめ、離職などで収入の大幅な減少があり、一時的に支払い困難な方
貝塚市,https://www.city.kaizuka.lg.jp/juyona_oshirase/27049.html,新型コロナウイルス感染症の影響による市税等の納付が困難な方へ／貝塚市 ,新型コロナウイルス感染症の影響により、下記支払金の納付が困難な場合、納付が一定期間猶予される制度があります。申請が必要となりますので、詳しくは各担当課にお問い合わせください。
仁木町,http://www.town.niki.hokkaido.jp/mobile/section/sangyouka/immd6j0000004e99.html,新型コロナウイルス感染症緊急貸付信用保証料補助金交付要綱の制定等について ｜仁木町 ,新型コロナウイルス感染症緊急貸付信用保証料補助金交付要綱の制定等について 新型コロナウイルス感染症緊急貸付信用保証料補助金交付要綱の制定等について｜仁木町
栃木県,http://www.pref.tochigi.lg.jp/f03/koronayuushi.html,栃木県／新型コロナウイルス感染症による影響を受けた中小企業に対する融資等の支援策について ,中小企業向け制度融資のご案内（新型コロナウイルス感染症緊急対策資金関連追加） 新型コロナウイルス感染症による影響を受けた中小企業に対する融資等の支援策について 新型コロナウイルス感染症に関する企業向け特別相談窓口の設置について 新型コロナウイルス感染症緊急対策資金保証料補給事業 栃木県／新型コロナウイルス感染症による影響を受けた中小企業に対する融資等の支援策について 県制度融資「経営安定資金（新型コロナウイルス感染症緊急対策資金）」
横手市,https://www.city.yokote.lg.jp/index.html,横手市 ,新型コロナウイルス感染症の拡大により、収入が減ってしまい家計が苦しいなど、生活に関するご相談を受け付けております。
